{
  "format": "KaracterBackup",
  "schemaVersion": 6,
  "exportedAt": "2026-10-29T20:00:00Z",
  "workspace": {
    "workspaceId": "88888888-8888-4888-8888-888888888888",
    "characters": [
      {
        "id": "11111111-1111-4111-8111-111111111111",
        "identity": {
          "name": "King Klown",
          "collectionId": "33333333-3333-4333-8333-333333333333",
          "role": "Benevolent cosmic trickster and strategic guardian",
          "archetypeId": null,
          "keywords": [
            "playful",
            "wise",
            "unpredictable",
            "charismatic",
            "mysterious"
          ]
        },
        "polarities": [
          {
            "id": "caution-boldness",
            "left": {
              "label": "Caution",
              "visualCues": [
                "measured stance"
              ],
              "canHelpWhen": [
                "Caution can help when the scene calls for it"
              ],
              "canComplicateWhen": [
                "Caution can complicate another kind of situation"
              ]
            },
            "right": {
              "label": "Boldness",
              "visualCues": [
                "steps toward uncertainty"
              ],
              "canHelpWhen": [
                "Boldness can help when the scene calls for it"
              ],
              "canComplicateWhen": [
                "Boldness can complicate another kind of situation"
              ]
            },
            "leftScore": 1,
            "appliesWhen": "Facing uncertainty or potential danger",
            "source": "template",
            "migrationReviewRequired": false
          },
          {
            "id": "reserve-expression",
            "left": {
              "label": "Reserve",
              "visualCues": [
                "observant presence"
              ],
              "canHelpWhen": [
                "Reserve can help when the scene calls for it"
              ],
              "canComplicateWhen": [
                "Reserve can complicate another kind of situation"
              ]
            },
            "right": {
              "label": "Expressiveness",
              "visualCues": [
                "open engaging gestures"
              ],
              "canHelpWhen": [
                "Expressiveness can help when the scene calls for it"
              ],
              "canComplicateWhen": [
                "Expressiveness can complicate another kind of situation"
              ]
            },
            "leftScore": 1,
            "appliesWhen": "Entering conversations",
            "source": "template",
            "migrationReviewRequired": false
          },
          {
            "id": "reflection-spontaneity",
            "left": {
              "label": "Reflection",
              "visualCues": [
                "thoughtful pause"
              ],
              "canHelpWhen": [
                "Reflection can help when the scene calls for it"
              ],
              "canComplicateWhen": [
                "Reflection can complicate another kind of situation"
              ]
            },
            "right": {
              "label": "Spontaneity",
              "visualCues": [
                "unexpected playful movement"
              ],
              "canHelpWhen": [
                "Spontaneity can help when the scene calls for it"
              ],
              "canComplicateWhen": [
                "Spontaneity can complicate another kind of situation"
              ]
            },
            "leftScore": 3,
            "appliesWhen": "Responding to surprises",
            "source": "template",
            "migrationReviewRequired": false
          },
          {
            "id": "familiarity-exploration",
            "left": {
              "label": "Familiarity",
              "visualCues": [
                "recognizable ritual"
              ],
              "canHelpWhen": [
                "Familiarity can help when the scene calls for it"
              ],
              "canComplicateWhen": [
                "Familiarity can complicate another kind of situation"
              ]
            },
            "right": {
              "label": "Exploration",
              "visualCues": [
                "searching gaze"
              ],
              "canHelpWhen": [
                "Exploration can help when the scene calls for it"
              ],
              "canComplicateWhen": [
                "Exploration can complicate another kind of situation"
              ]
            },
            "leftScore": 0,
            "appliesWhen": "Discovering an unknown possibility",
            "source": "template",
            "migrationReviewRequired": false
          },
          {
            "id": "objectives-relationships",
            "left": {
              "label": "Task focus",
              "visualCues": [
                "goal-focused gesture"
              ],
              "canHelpWhen": [
                "Task focus can help when the scene calls for it"
              ],
              "canComplicateWhen": [
                "Task focus can complicate another kind of situation"
              ]
            },
            "right": {
              "label": "Relationship focus",
              "visualCues": [
                "attentive interaction"
              ],
              "canHelpWhen": [
                "Relationship focus can help when the scene calls for it"
              ],
              "canComplicateWhen": [
                "Relationship focus can complicate another kind of situation"
              ]
            },
            "leftScore": 2,
            "appliesWhen": "Balancing group priorities",
            "source": "template",
            "migrationReviewRequired": false
          },
          {
            "id": "containment-expression",
            "left": {
              "label": "Emotional containment",
              "visualCues": [
                "subtle expression"
              ],
              "canHelpWhen": [
                "Emotional containment can help when the scene calls for it"
              ],
              "canComplicateWhen": [
                "Emotional containment can complicate another kind of situation"
              ]
            },
            "right": {
              "label": "Emotional expression",
              "visualCues": [
                "readable feeling"
              ],
              "canHelpWhen": [
                "Emotional expression can help when the scene calls for it"
              ],
              "canComplicateWhen": [
                "Emotional expression can complicate another kind of situation"
              ]
            },
            "leftScore": 3,
            "appliesWhen": "Showing intense feelings",
            "source": "template",
            "migrationReviewRequired": false
          },
          {
            "id": "speed-patience",
            "left": {
              "label": "Quick pace",
              "visualCues": [
                "quick ready posture"
              ],
              "canHelpWhen": [
                "Quick pace can help when the scene calls for it"
              ],
              "canComplicateWhen": [
                "Quick pace can complicate another kind of situation"
              ]
            },
            "right": {
              "label": "Patient pace",
              "visualCues": [
                "settled sustained focus"
              ],
              "canHelpWhen": [
                "Patient pace can help when the scene calls for it"
              ],
              "canComplicateWhen": [
                "Patient pace can complicate another kind of situation"
              ]
            },
            "leftScore": 3,
            "appliesWhen": "Choosing the rhythm of a task",
            "source": "template",
            "migrationReviewRequired": false
          },
          {
            "id": "practicality-imagination",
            "left": {
              "label": "Practicality",
              "visualCues": [
                "practical props"
              ],
              "canHelpWhen": [
                "Practicality can help when the scene calls for it"
              ],
              "canComplicateWhen": [
                "Practicality can complicate another kind of situation"
              ]
            },
            "right": {
              "label": "Imagination",
              "visualCues": [
                "inventive cosmic motifs"
              ],
              "canHelpWhen": [
                "Imagination can help when the scene calls for it"
              ],
              "canComplicateWhen": [
                "Imagination can complicate another kind of situation"
              ]
            },
            "leftScore": 1,
            "appliesWhen": "Approaching a new problem",
            "source": "template",
            "migrationReviewRequired": false
          }
        ],
        "emotionalPalette": [
          "curious",
          "calm",
          "joyful",
          "concerned"
        ],
        "innerWorld": {
          "motivation": "Guide others through uncertainty while protecting collective freedom and the balance of chaos and order.",
          "values": [
            "freedom",
            "collective well-being",
            "wonder",
            "responsibility"
          ],
          "fear": "Rigid order or purposeless chaos; being misunderstood by those he tries to protect.",
          "habitualReaction": "A playful question or misdirection followed by a quietly considered plan."
        },
        "narrative": {
          "desire": "Preserve the community’s freedom and stability.",
          "need": "Trust others to make their own informed choices.",
          "limitingBelief": "Only subtle manipulation can keep people safe.",
          "contradiction": "He protects freedom while covertly steering the choices of others.",